Source Organization,Report/Data,Publication Date,URL/Access,Reliability,Metric Covered
IDC (International Data Corporation),Latin America Data Center Market Report,2024-2025,https://www.idc.com/,5/5,Capacity by region; Growth rates; Market sizing; Regional trends
Statista,Data Center Infrastructure - Mexico Outlook,2024-2025,https://www.statista.com/outlook/,5/5,Market value; Capacity; YoY growth projections; Historical trends
AWS (Amazon Web Services),Global Infrastructure Documentation,Current,https://aws.amazon.com/es/about-aws/global-infrastructure/,5/5,Official CDMX region capacity; Hyperscale metrics; Investment trends
Google Cloud,Official Infrastructure Locations,Current,https://cloud.google.com/about/locations,5/5,Mexico City data center details; Cloud capacity; Service availability
Microsoft Azure,Azure Global Infrastructure,Current,https://azure.microsoft.com/es-es/global-infrastructure/,5/5,Mexico LatAm region specifications; Hyperscale deployment
Gartner,Infrastructure & Operations Survey,2024-2025,https://www.gartner.com/,4/5,Enterprise IT deployment preferences; Technology adoption curves
Mordor Intelligence,Mexico Data Center Market Analysis,2024-2025,https://www.mordorintelligence.com/,4/5,Regional market dynamics; Growth forecasts; Sector analysis
GitHub (Microsoft),Data Center Infrastructure Discussion,2024,https://github.blog/,4/5,Cloud infrastructure trends; Enterprise adoption patterns; Tech sector insights
Mexican Government (Gov.mx),Digital Transformation Plan 2024-2026,2024,https://www.gob.mx/,4/5,Government IT infrastructure; Digitalization priorities; Regional investment
